<!-- Autogenerated from CAM template by XSLT (version 2.16) 
                    
                    CAM Template HEADER information: 
                    
                    Description: No Description 
                    Owner: Not Set 
                    Date: 2014-08-04T11:10:33 
                    Version: 0.1 
                    
                    SETTINGS: 
                    Seed: 0.7233482617587541 
                    Hints file: 
                    Optional items:  
                    Choice mode: one
                    Input repeat count: 3
                    Default content:  
                    Random error mode: 
                    Debug mode: false
                    Schema: D:\SoftDev\Qt\openIndy\schema\openIndySchema.xsd
                    Namespace mode: true --><oiProjectData xmlns:xsi="http://www.w3.org/2001/XMLSchema-instance"
               xsi:noNamespaceSchemaLocation="D:/SoftDev/Qt/openIndy/schema/openIndySchema.xsd"
               name="string"
               date="string"
               idcount="332720">
   <activeCoordinatesystem ref="793028"/>
   <activeStation ref="1.032334E6"/>
   <stations>
      <station id="561156" name="string">
         <activeSensor name="string" plugin="string">
            <readingTypes>
               <type name="string"/>
            </readingTypes>
         </activeSensor>
         <position ref="763007"/>
         <coordinatesystem ref="547048"/>
      </station>
      <station id="1.027472E6" name="string">
         <activeSensor name="string" plugin="string">
            <readingTypes>
               <type name="string"/>
               <type name="string"/>
            </readingTypes>
         </activeSensor>
         <position ref="219534"/>
         <coordinatesystem ref="1.061597E6"/>
      </station>
      <station id="1.136994E6" name="string">
         <activeSensor name="string" plugin="string">
            <readingTypes>
               <type name="string"/>
            </readingTypes>
         </activeSensor>
         <position ref="760299"/>
         <coordinatesystem ref="72603"/>
      </station>
   </stations>
   <coordinatesystems>
      <coordinatesystem id="426155" name="string" solved="false"/>
      <coordinatesystem id="406168" name="string" solved="false"/>
      <coordinatesystem id="27284" name="string" solved="false"/>
   </coordinatesystems>
   <geometries>
      <geometry id="895572" name="string" type="string" nominal="false" common="false"
                solved="false">
         <coordinates x="31.02" y="71.73" z="70.6" sigmaX="97.57" sigmaY="45.02" sigmaZ="90.33"/>
         <standardDeviation value="28.09"/>
      </geometry>
   </geometries>
</oiProjectData>