<!-- Autogenerated from CAM template by XSLT (version 2.16) 
                    
                    CAM Template HEADER information: 
                    
                    Description: No Description 
                    Owner: Not Set 
                    Date: 2014-08-04T11:10:33 
                    Version: 0.1 
                    
                    SETTINGS: 
                    Seed: 0.7233482617587541 
                    Hints file: 
                    Optional items:  
                    Choice mode: one
                    Input repeat count: 3
                    Default content:  
                    Random error mode: 
                    Debug mode: false
                    Schema: D:\SoftDev\Qt\openIndy\schema\openIndySchema.xsd
                    Namespace mode: true --><oiProjectData xmlns:xsi="http://www.w3.org/2001/XMLSchema-instance"
               xsi:noNamespaceSchemaLocation="D:/SoftDev/Qt/openIndy/schema/openIndySchema.xsd"
               name="string"
               date="string"
               idcount="875673">
   <activeCoordinatesystem ref="1.029017E6"/>
   <activeStation ref="971094"/>
   <stations>
      <station id="774343" name="string">
         <activeSensor name="string" plugin="string">
            <readingTypes>
               <type name="string"/>
               <type name="string"/>
            </readingTypes>
         </activeSensor>
         <position ref="1.233953E6"/>
         <coordinatesystem ref="1.112601E6"/>
      </station>
   </stations>
   <coordinatesystems>
      <coordinatesystem id="1.038907E6" name="string" solved="false"/>
      <coordinatesystem id="178654" name="string" solved="false"/>
      <coordinatesystem id="438955" name="string" solved="false"/>
   </coordinatesystems>
   <geometries>
      <geometry id="24822" name="string" type="string" nominal="false" common="false"
                solved="false">
         <coordinates x="79.41" y="117.66" z="46.9" sigmaX="19.5" sigmaY="6.07" sigmaZ="13.02"/>
         <standardDeviation value="52.44"/>
      </geometry>
   </geometries>
</oiProjectData>